{
  "tenant_id": "acme-corp",
  "run_id": "run-0001",
  "engine_id": "chatgpt-search",
  "observation_id": "obs-0001",
  "raw_object_ref": "s3://saena-observations/run-0001/obs-0001.json",
  "artifact_hash": "sha256:18874da76bec7d21e4591f1f61e4a3c589a48e70e67384ab17a7f8975376855c",
  "citation_refs": ["https://example.com/product/widget"],
  "captured_at": "2026-07-13T09:14:32Z"
}
